{
  "name": "chronovolt_memory_core_catalog",
  "generated_utc": "2025-08-28T18:17:52Z",
  "modules": {
    "memory_core.json": {
      "path": "/mnt/data/chronovolt_modules/memory_core.json",
      "bytes": 1411,
      "sha256": "d0c38350480ef16437dbae7db3ac7d990fde94ecf2cc20a87fb6404fdecb613b"
    },
    "ui.json": {
      "path": "/mnt/data/chronovolt_modules/ui.json",
      "bytes": 2790,
      "sha256": "e38981e6b0f7b32247090e4d7b05e25a494769a4b7b1287ed3f834245f0fd12e"
    },
    "hardware.json": {
      "path": "/mnt/data/chronovolt_modules/hardware.json",
      "bytes": 2076,
      "sha256": "216fa7f75a7a2770118fb49fd4cd9c982ded5bca2a2a67ff6c2e77f6759871bd"
    },
    "projects.json": {
      "path": "/mnt/data/chronovolt_modules/projects.json",
      "bytes": 984,
      "sha256": "78cf00012e901004729167c6127e77587f0bb9ccd9ed055a8fd1c54a724774c2"
    },
    "output_pipeline.json": {
      "path": "/mnt/data/chronovolt_modules/output_pipeline.json",
      "bytes": 403,
      "sha256": "d0db51d73a3bc08c494c8e624aab07cde732628a83e925766882bff5b55be86d"
    },
    "references.json": {
      "path": "/mnt/data/chronovolt_modules/references.json",
      "bytes": 535679,
      "sha256": "f43392c80c7378fbd7bb7295e450cc42429ea34cca0f3991042ff92a57aa5f7a"
    }
  },
  "source_files": {
    "chronovolt_memory_core_compact_v1.json": {
      "path": "/mnt/data/chronovolt_memory_core_compact_v1.json",
      "bytes": 8583,
      "sha256": "616671bb130226427649f000c273825cc9643a95243062b4d76238324b609890"
    },
    "MOTHER_BRAIN.json": {
      "path": "/mnt/data/MOTHER_BRAIN.json",
      "bytes": 164297,
      "sha256": "74cb21403c3188004961aa87ee5098c562683b0061f2f9e77c49083a810933d5"
    }
  }
}